product_id|model|label|description|category_id|brand|image|status
1000543|EHA|actionneur linéaire / hydraulique / compact|Vérins compacts E H A<br> <br> Vérins compacts E H A, autonomes, intégrant moteur, pompe, vérin, pression de service maxi de 207 bar , 3 alésages, courses jusqu'à 203 mm, efforts jusqu'à 22 kN, températures de -29° à +65°C.|60301|Parker|1545131276164-447ac695-03cb-413e-a3e9-3cd032b2f1c3|DONE
1000544|DGSC series|actionneur linéaire / pneumatique / à double effet / de précision|<br> Taille 6<br> Diamètre 6 mm<br> Longueur de course 1 … 10 mm<br> Force 12,5 ... 17 N<br> <br> Caractéristiques spécifiques:<br> <br> Pour faibles courses|60302|festo|1545131280599-af93fa2f-972a-485c-8fba-674f52d536b2|DONE
1000545|DGSL|actionneur linéaire / pneumatique / à double effet / à détection de position|<br> Taille 4, 6, 8, 10, 12, 16, 20, 25<br> Diamètre 6, 8, 10, 12, 16, 20, 25, 32 mm<br> Longueur de course 10 ... 200 mm<br> Force 17 ... 483 N<br> Détection de position<br> Amortissement fixe / réglable<br> Guidage par cages à billes.|60302|festo|1545131284838-a2be0e48-976a-49d5-8180-dca2a187d85f|DONE
1000546|SLF|actionneur linéaire / pneumatique / à double effet / à détection de position|<br> Diamètre 6, 10, 16 mm<br> Course 10 ... 80 mm<br> Force/Couple 17 ... 121 N<br> Détection de position<br> Amortissement fixe<br> Patin à billes.<br> <br> Caractéristiques spécifiques:<br> <br> Conception plate|60302|festo|1545131288975-b4343058-297f-4740-aca5-400032fc1451|DONE
1000547|OSPPBG series|actionneur linéaire / pneumatique / à double effet / sans tige|Vérins sans tige avec guidage intégré OSPPBG Origa. Diamètres 25,32 et 40 mm. Courses jusqu'à 6000 mm.<br> <br> Guidage intégré compact et robuste, conçu pour des charges élevées et offrant une endurance à toute épreuve. Le guidage est directement intégré dans le corps du vérin. La version Basic Guide vient compléter la gamme modulaire des vérins sans tige de parker Origa. Il s'intercale entre la version standard des vérins sans tige OSPP et la version avec guidage extérieur Slideline à patins lisses. Le nouveau Basic Guide, plus compact, s'inscrit ainsi comme la solution idéale pour toutes les applications nécessitant une intégration simple et rapide dans des encombrements réduits.|60302|Parker|1545131294193-4687a32c-7960-4fc4-8d87-97d09d170c46|DONE
1000548|PRN, PRO series|actionneur rotatif / pneumatique / à double effet / à simple effet|Actionneurs rotatifs à palettes PRN et PROGamme de vérins rotatifs double effet à simple ou double palette. 9 tailles différentes, 3 courses angulaires 90, 180 ou 270 degrés, course angulaire fixe et réglable par 15 degrés sur la version PRO. Mouvement de rotation régulier sans à coup, en basse vitesse et basse pression, grâce à un taux de fuite interne minimum. Forte capacité à absorber l'énergie cinétique en fin de course, axe et palette monobloc forgée en une seule pièce. Butées avec amortissement élastique interne pour les fins de course angulaires. Butées avec amortisseurs hydrauliques en option sur la version PRN. Détection possible des fins de course angulaires par l'ajout de capteurs électriques.|60302|Parker|1545131300306-c701108d-606a-4f8a-a822-f449026102b8|DONE
1000549|VRS series|actionneur rotatif / pneumatique / à pignon crémaillère|Actionneurs rotatifs à pignon crémaillère VRSActionneurs rotatifs à pignon crémaillère VRS|60302|Parker|1545131305165-3b6cc396-8fdf-4b42-bff7-2cc4903fc310|DONE
1000550|HMI, HMD series|vérin hydraulique / double effet / ISO / à tirants|Vérins linéaires à tirants HMI/HMD<br> <br> Vérins linéaires à tirants HMI/HMD, selon la norme ISO 6020/2, pression de 210 bar, alésage 25 à 200 mm, conception personnalisée possible et nombreux accessoires.|60303|Parker|1545131310499-eba9f6d1-503a-47b7-a99a-8aee8e05aa84|DONE
