product_id|model|label|description|category_id|brand|image|status
1000235|787 - 87x series|UPS off-line / DC / pour batterie / sur rail DIN|Les chutes de tension imprévues peuvent avoir de lourdes conséquences pour les utilisateurs de machines ou d'installations. La mise hors tension d'un automate lors d'une coupure d'alimentation peut engendrer des dommages majeurs à cause de la perte de données de production (recettes, protocoles,etc.). Les alimentations sans coupure, combinant un système de contrôle d’alimentation secourue 787-870 ou 787-875 avec un ou plusieurs modules accumulateur pour le stockage de l'énergie, garantissent une alimentation fiable durant plusieurs heures. La tension de charge du module accumulateur connecté est contrôlé par la température, ce qui augmente considérablement la durée de vie des accumulateurs et minimise les coûts de maintenance. Le contrôle permanent de la tension et du courant, ainsi que de nombreuses options de visualisation sont disponibles à partir de l'écran LCD ou de l'interface logicielle (pour la connexion série RS-232).|40214|wago|1545131302488-7659de4b-92f3-499a-940b-25c074434013|DONE
1000236|Weidmüller|UPS DC / pour batterie / industriel|L'alimentation sauvegardée (UPS), associée au module de batteries et à l'alimentation électrique, constitue un système UPS DC. En fonctionnement normal, la tension d'entrée issue de l'alimentation sauvegardée (UPS) est raccordée directement à la charge. En cas de défaillance du réseau (chute de la tension DC en entrée), le système bascule instantanément en mode batterie. Dès le rétablissement du réseau, le système revient en mode normal et la batterie est rechargée par un chargeur intégré.<br> Trois sorties à relais, ainsi que trois sorties à transistors actifs et une entrée de commande pour verrouiller le fonctionnement de la batterie fournissent un contrôle complet à distance, via PLC (UPS) ou DCS. De nombreux modes d'utilisation et un affichage d'état simple fournissent un diagnostic de dysfonctionnement rapide et une adaptation optimale.|40214|Weidmüller|1545131312451-a084010e-e905-4dd4-9a8e-70e3c082f9d0|DONE
1000237|SITOP BAT8600|batterie lithium fer phosphate / modulaire / sans entretien|Transition de plus longues pannes de courant durant des minutes aux heures avec la pleine puissance de système<br> <br> Une alimentation d'énergie non interruptible avec les modules de batterie appropriés peut être employée pour se protéger contre de plus longues immersions de puissance sur la ligne côté et pour jeter un pont sur ainsi des pannes de courant durant des minutes aux heures. Ces modules d'expansion permettent pour fermer l'usine sans risque et sélectivement en cas d'une panne de courant. Pour la plupart des interruptions de puissance, le temps traversier est suffisant pour permettre à l'usine de continuer de fonctionner sans rupture.<br> <br> Module UPS8600 pour le contrôle de charge/décharge avec jusqu'à cinq modules de batterie BAT8600 de la même connexion simple de construction d'UPS8600 par l'intermédiaire du lien d'agrafe de système, d'un connecteur pour des données du système et de gestion futée de batterie d'alimentation d'énergie pour les modules de batterie optimaux de durée de vie de batterie BAT8600 avec les batteries exemptes d'entretien d'acide de plomb ou de lithium de fer de phosphate|40216|siemens|1545131317261-4cca16fc-dc1b-43d3-8e93-54cae44044a6|DONE
1000238|SITOP UPS1100 24 V/1.2 Ah|batterie plomb / de bloc|En cas de coupure de courant, non seulement la tension alternative est coupée, mais aussi l'alimentation 24 V et donc l'ensemble du système d'automatisation. Cela peut être à l'origine de temps d'arrêt coûteux et d'états d'installation non définis.<br> <br> Les alimentations DC-UPS avec blocs-batteries empêchent la réalisation de ce scénario grâce à un tampon 24 V fiable pour une durée atteignant l'ordre de quelques heures. Les produits SITOP UPS1600 innovants offrent en outre de nouvelles possibilités de diagnostic et d'intégration dans le système. Ils disposent d'un grand nombre de fonctions, d'une communication ouverte via USB ou Ethernet/Profinet et sont entièrement intégrés dans Totally Integrated Automation (TIA).|40216|siemens|1545131323176-2df0ca5e-44a2-4fdf-82c8-8474bf7cd999|DONE
1000239|SITOP UPS1100 24 V/3.2 Ah|batterie plomb / de bloc|Blocs-batteries SITOP UPS1100 1,2 Ah à 12 Ah ne nécessitant pas de maintenance avec différents accumulateurs d'énergie (plomb, plomb pur, lithium fer phosphate = LiFePo) pour modules DC UPS SITOP UPS1600. La gestion intelligente des accumulateurs de l'UPS1600 charge l'UPS1100 avec la caractéristique de température optimale et surveille via Energy Storage Link l'état (données de service, informations de diagnostic) des blocsbatteries<br> raccordés. L'autonomie peut être prolongée avec la mise en parallèle de six blocs-batteries. La fixation s'effectue sur rail DIN symétrique ou en montage mural direct.|40216|siemens|1545131329218-d30ecd8a-f209-4fed-a331-e4e5ae115702|DONE
1000240|5 - 35 kW # BORDLINE®|chargeur de batterie universel / à pose murale / automatique|Ces convertisseurs sont conçus pour que l'entrée de C.C ou à C.A. fournisse les C.C-charges sur des véhicules de traction en tension CC Très douce et stabilisée, aussi bien que charger les batteries.<br> <br> Les unités sont disponibles dans un logement éclabousser-résistant pour monter en dehors du véhicule ou comme module complet à inclure dans un coffret électrique commun/logement principal de convertisseur. <br> <br> Toutes les tensions connues de batterie et limitations courantes sont possibles. Les unités standard avec une gamme de puissance de sortie entre 5 et 35 kilowatts sont déjà en fonction. <br> <br> Le Special a adapté la conception aux besoins du client et de puissance de sortie être disponible sur demande.|40218|abb|1545131334074-b28806be-acc8-429d-9300-f682031f6fd1|DONE
1000241|SDC series|chargeur de batterie universel / au sol / redresseur à thyristor / automatique|Redresseur industriel de thyristor de 25 - 1200ADC et plus haut.<br> <br> Description :<br> <br> Le SDC est fortement flexible et satisfait les demandes fortement spécifiques même dans la diverse autonomie des périodes. Construit sur la plateforme de xxW il est semblable à tous autres produits sur la plateforme (SIÈGE, PDW, WEW et WDW). Le SDC peut tolérer même des situations environnementales vraiment dures. Le progiciel est certifié avec l'IEC60880 pour des applications de NPP (centrale nucléaire).<br> <br> Ce produit est qualité et est un des meilleure parmi la classe due à l'attention de GUTOR sur la qualité et au foyer au détail.|40218|schneider|1545131339478-23eb4479-19c4-4341-aaef-498841bda36f|DONE
1000242|30 - 1 000 W # PB series|chargeur de batterie plomb-acide / fixe / à découpage|dispositifs de ? :<br> remplissage de 3 étapes<br> C.A. 115/230VAC choisi par le commutateur<br> Conformité intégrée de fonction du passif PFC EN61000-3-2 à la classe A {option)<br> Protection : Court-circuit/polarité/tension d'excédent/température renversées d'excédent<br> Batteries d'acide de plomb de massif de roche de chargeur<br> indicateur de chargement de 2 couleurs LED<br> À prix réduit. Fiabilité élevée<br> ÉVENTEZ la commande ""Marche/Arrêt"" {dépend du courant de remplissage)<br> 3 ans de garantie|40218|MEAN WELL|1545131345689-468db437-e42d-4da0-87ab-6550b1fbdfd0|DONE
1000243|SITOP BAT8600 PB|module tampon pour alimentation électrique DC sur rail DIN|Transition de plus longues pannes de courant durant des minutes aux heures avec la pleine puissance de système<br> <br> Une alimentation d'énergie non interruptible avec les modules de batterie appropriés peut être employée pour se protéger contre de plus longues immersions de puissance sur la ligne côté et pour jeter un pont sur ainsi des pannes de courant durant des minutes aux heures. Ces modules d'expansion permettent pour fermer l'usine sans risque et sélectivement en cas d'une panne de courant. Pour la plupart des interruptions de puissance, le temps traversier est suffisant pour permettre à l'usine de continuer de fonctionner sans rupture.<br> <br> Module UPS8600 pour le contrôle de charge/décharge avec jusqu'à cinq modules de batterie BAT8600 de la même connexion simple de construction d'UPS8600 par l'intermédiaire du lien d'agrafe de système, d'un connecteur pour des données du système et de gestion futée de batterie d'alimentation d'énergie pour les modules de batterie optimaux de durée de vie de batterie BAT8600 avec les batteries exemptes d'entretien d'acide de plomb ou de lithium de fer de phosphate|40220|siemens|1545131353058-94c17d74-776d-41fa-b7da-4c6c7c230b45|DONE
1000244|SITOP BUF8600 100 ms/40 A|module tampon pour alimentation électrique DC sur rail DIN|Les modules tampon BUF8600 font partie du système modulaire SITOP PSU8600 et permettent de ponter de brèves coupure de courant. Ils utilisent comme accumulateur d'énergie des condensateurs à électrolyte sans entretien et assurent automatiquement<br> l'alimentation en tension continue en cas de coupure de la tension du réseau. Il est possible de raccorder jusqu'à deux modules d'extension BUF8600 à l'appareil de base<br> PSU8600. La liaison s'effectue au niveau de la face supérieure des modules, sans aucun travail de câblage, via le système Clip Link, un connecteur de liaison pour données système et alimentation en énergie.|40220|siemens|1545131357353-cd2f9b59-32bc-49ca-8104-41f4d2544d63|DONE
1000245|SITOP BUF8600 300 ms/40 A|module tampon pour alimentation électrique DC sur rail DIN|Les modules tampon BUF8600 font partie du système modulaire SITOP PSU8600 et permettent de ponter de brèves coupure de courant. Ils utilisent comme accumulateur d'énergie des condensateurs à électrolyte sans entretien et assurent automatiquement<br> l'alimentation en tension continue en cas de coupure de la tension du réseau. Il est possible de raccorder jusqu'à deux modules d'extension BUF8600 à l'appareil de base<br> PSU8600. La liaison s'effectue au niveau de la face supérieure des modules, sans aucun travail de câblage, via le système Clip Link, un connecteur de liaison pour données système et alimentation en énergie.|40220|siemens|1545131361511-5616b7f4-fb1f-4187-b607-38a9f4884f59|DONE
1000036|901|pressostat pour liquides / différentiel / ATEX|Appartement pour les liquides et le gaz, même les agressifs, selon le diaphragme matériel<br> Options :<br> Diaphragme dans différents matériaux<br> Connexions en matériaux et diamètres de diferents. Connexions filetées<br> Version d'ATEX<br> Spécial pour l'OEM de clients : versions echonomical avec des valeurs préréglées<br> Quelques modèles exigent la quantité minimum<br> «&nbsp;901.6X&nbsp;» = surpression, «&nbsp;901.7X&nbsp;» = pression négative, pression de «&nbsp;901.8X&nbsp;» Diferential|10110|IFM|1545131172347-ed1055c9-dac3-42fc-a470-63242a9cd1f2|DONE
1000037|SPBA|pressostat pour air / mécanique / en inox / IP65|<br> Pression -1… 10 bar<br> Tension 24 VCC<br> 2x PNP ou avec contact<br> Capteur de pression<br> Capteur de vide<br> Point de commutation fixe.|10110|festo|1545131176870-5d32bd88-9238-441f-92a9-6c9ea9a2725d|DONE
1000038|81 513 series|pressostat pour air / électromécanique / basse pression|Conformez-vous à la directive de basse tension<br> Peut être employé sans clôture selon <br> Groupe de pollution du CEI 664-1 II|10110|crouzet|1545131181137-c54a4c7b-ab28-4508-81bd-e5a46798f5a6|DONE
1000039|VNA001, VSP0, VSA series|accéléromètre 1 axe / piézoélectrique / capacitif / IEPE|Le système de contrôle structurel d'iFm qui se spécialise pour des vibrations structurelles avec la basse accélération comporte un capteur de vibration avec une haute résolution. Le produit montre un à faible bruit de 3.3g, une action libre de saturation dans une possibilité d'une surcharge et un autotest pour se volatiliser des procédés de calibrage. Le système de contrôle comporte également une estimation élevée de protection d'IP 69K avec une surveillance fiable des vibrations structurelles. <br> <br> Pour son application, la surveillance exige de haute résolution dans un petit secteur de mesure et l'autotest intégré exécute la capacité du produit pour avoir une lecture précise. En outre, le VSA modèle 101 est le capteur suggéré quand il s'agit de détection des structures stationnaires ou mobiles.|10504|IFM|1545131185966-92b9721d-9dd1-478c-aeb4-0fcd4036a9cd|DONE
1000040|KT50 series|capteur tactile capacitif|Commutation sans contact et sans pression<br> LED pour signalisation visuelle<br> Résistant à l'huile, résistant aux impacts et à l'abrasion<br> Enjoliveurs disponibles en différentes couleurs<br> Montage mural ou encastré simple|10524|IFM|1545131190702-3716f68b-52ca-4b3c-82b9-ee9d48c64f99|DONE
1000041|KT53 series|capteur tactile capacitif|Sans usure, ni entretien grâce à la commutation sans pression mécanique<br> Principe dynamique pour la suppression de tentatives de manipulation<br> Montage facile dans des boîtiers avec un trou de montage de Ø 22,5 mm<br> Principe de contrôle prédéfini, dynamique ou statique<br> Symboles sur la surface active sélectionnables séparément|10524|IFM|1545131196154-d8b5245e-d3b8-4f6b-b734-24d823687d53|DONE
1000042|IcountPD|détecteur de particules / pour fluide hydraulique / pour applications hydrauliques|Dtecteurs de particules Icount PD<br> <br> Dtecteur de particules pour l'analyse en ligne de la pollution des fluides hydrauliques. Mesure de teneur en eau en option. Affichage digital ou LED. Pression maximum : 420 bar. Une solution conomique pour prolonger la dure de vie du fluide et du systme.|10524|Parker|1545131202238-ee19f0d3-57cf-4c52-ae3d-d8e45e6150e8|DONE
1000043|icount PDR|détecteur de particules / robuste / pour liquide|Détecteur de particules icount PDR - version robusteDétecteur de particules pour l'analyse en ligne de la pollution des fluides dans les environnements agressifs.|10524|Parker|1545131207204-f9b5661f-a5ca-4604-8c2b-1e3f308c8d83|DONE
1000044|89750183|capteur de lumière|Branchement direct, sans convertisseur, sur entrée<br> analogique<br> Solution économique de contrôle de lumière<br> Domaines d’utilisation : gestion de l’éclairage, économies d’énergie|10524|crouzet|1545131211800-70fc6bff-6b7c-4923-8676-29437ac780a0|DONE
1000045|270 x 77 x 58 mm, 3 m # Guardian2|détecteur de mouvement / radar|GUARDIAN 2 est un détecteur destiné aux portes piétonnes coulissantes. Il combine une zone de détection de mouvement et une zone de détection de pré sence (sécurité). Le détecteur repose sur la technologie de caméra CMOS. La détection est basée sur le traitement dimages. La zone de mouvement réagit uniquement aux mouvements, tandis que la zone de présence réagit à la fois aux mouvements et à la présence dun objet ou dune personne. La zone de mouvement peut être occultée dans les trois sens (avant, gauche et droite) afin de ne pas détecter des objets indésirables. La zone de présence est mémorisée dans le détecteur grâce à la reconnaissance de cibles placées dans louverture durant la phase de configuration - il s'adaptera à la forme d'une porte coulissante cintrée ou droite. Par ailleurs, la zone de présence sadapte au cadre environnant pour fonctionner dans différentes conditions météorologiques. Le détecteur est doté de sorties séparées pour les zones de mouvement et de présence ainsi que dune entrée test qui permet de contrôler le fonctionnement du détecteur à chaque cycle douverture de la porte.|10524|CARLO GAVAZZI|1545131216514-067b7bc4-b143-4f03-9641-852a22480f0a|DONE
1000046|.|détecteur de mouvement / infrarouge passif / mural|Détecteurs de mouvement et de présence<br> Ces détecteurs sensibles au rayonnement infrarouge, détectent le passage et la présence de personnes et commandent en automatique un éclairage.|10524|hager|1545131220758-102668ab-bbc8-43c9-a4a7-96a61113b8b4|DONE
1000047|SOPA|capteur d'entrefer|<br> Plage de détection 20 … 200 µm<br> Pression 4 … 7 bar<br> Sorties de commutation PNP ou NPN<br> Fonction d'éjection par jet d'air intégrée<br> Afficheur LCD multi-couleur<br> Air comprimé filtré, lubrifié ou non lubrifié<br> Rail DIN, montage sur panneau, passe-cloison|10524|festo|1545131225465-a6d33aff-f24f-49aa-a285-dcfa601427b6|DONE
1000048|SM001|multimètre numérique / sur rail DIN / industriel|Caractéristiques techniques<br> Classe de précision: 0.5%<br> Tension assignée d’emploi en alternatif: 184/230/276<br> Fréquence assignée: 50/60 Hz<br> Puissance consommée: 0,5 VA<br> Section de raccordement en câble rigide: 1,5 / 10mm²<br> Section de raccordement en câble souple: 1 / 6mm²<br> Plage de mesure de courant: 0,1 à 6<br> Plage de mesure de tension: 35 à 480 V<br> Température de fonctionnement: -15 à 50 °C<br> Température de stockage: -20 à 70 °C<br> Indice de protection IP: 30<br> Nombre de modules: 4|10601|hager|1545131230637-aca33769-7068-46cd-8d26-7ba32b1e8d8b|DONE
1000049|Weidmüller|multimètre numérique / portable / 600 V / cat III|Les multimètres peuvent mesurer un grand nombre de grandeurs. De manière standard, tous les instruments peuvent mesurer la tension et la résistance et peuvent effectuer des tests de continuité et de diodes. <br> Certains multimètres permettent en plus de mesurer le courant, la fréquence, la capacité et la température. Les multimètres numérique ont l'avantage de présenter un affichage clair, facilement et directement lisible. Les erreurs de conversion d'échelle ou les erreurs de lecture appartiennent au passé.|10601|Weidmüller|1545131236246-a3e00712-f3ab-4155-83ea-f99999e3d3d8|DONE
1000050|max. 80 V # WM14 series|analyseur pour réseau électrique / de puissance / à intégrer|Les systèmes de gestion d'énergie Carlo Gavazzi fournissent des informations afin que les opérateurs puissent identifier les tendances de consommation et prendre des mesures correctives. Selon la puissance consommée, les opérateurs peuvent également regrouper les charges et donc négocier de meilleurs tarifs avec les fournisseurs d'électricité. Le suivi en temps réel permet également au gestionnaire de site d'anticiper les conditions de surcharge comme par exemple le déclenchement d'un disjoncteur. Les alarmes peuvent être définies pour avertir le gestionnaire si les limites fixées sont atteintes. Les solutions pour la gestion dénergie Carlo Gavazzi répondent aux exigences des bâtiments commerciaux, des installations de production, de l'industrie, des services et des infrastructures.|10605|CARLO GAVAZZI|1545131240783-7bd740e8-7206-448a-b54a-d6512f35e263|DONE
1000051|EM series|compteur d'énergie électrique monophasé / sur rail DIN|Les systèmes de gestion d'énergie Carlo Gavazzi fournissent des informations afin que les opérateurs puissent identifier les tendances de consommation et prendre des mesures correctives. Selon la puissance consommée, les opérateurs peuvent également regrouper les charges et donc négocier de meilleurs tarifs avec les fournisseurs d'électricité. Le suivi en temps réel permet également au gestionnaire de site d'anticiper les conditions de surcharge comme par exemple le déclenchement d'un disjoncteur. Les alarmes peuvent être définies pour avertir le gestionnaire si les limites fixées sont atteintes. Les solutions pour la gestion dénergie Carlo Gavazzi répondent aux exigences des bâtiments commerciaux, des installations de production, de l'industrie, des services et des infrastructures.|10606|CARLO GAVAZZI|1545131248449-5ee4ed69-e8be-458e-bba2-85d78966c592|DONE
1000052|70 - 830 V, max. 10 A # EM series|analyseur pour réseau électrique / de qualité d'énergie / à intégrer|Les systèmes de gestion d'énergie Carlo Gavazzi fournissent des informations afin que les opérateurs puissent identifier les tendances de consommation et prendre des mesures correctives. Selon la puissance consommée, les opérateurs peuvent également regrouper les charges et donc négocier de meilleurs tarifs avec les fournisseurs d'électricité. Le suivi en temps réel permet également au gestionnaire de site d'anticiper les conditions de surcharge comme par exemple le déclenchement d'un disjoncteur. Les alarmes peuvent être définies pour avertir le gestionnaire si les limites fixées sont atteintes. Les solutions pour la gestion dénergie Carlo Gavazzi répondent aux exigences des bâtiments commerciaux, des installations de production, de l'industrie, des services et des infrastructures.|10613|CARLO GAVAZZI|1545131253826-3179c762-11bf-4218-9083-39e513a59454|DONE
1000053|PMX400 series|fréquencemètre numérique|Fréquencemètre et totaliseur avec fonctions supplémentaires et alimentation de tension externe <br> pour installation en panneau de commande.<br> <br> La série PMX400 propose un affichage LED 4 caractères de haute qualité et des fonctionnalités supplémentaires<br> . Les afficheurs permettent de traiter les signaux de fréquence les plus divers. Côté sortie, des signaux analogiques sont disponibles en option, ainsi que deux ou quatre contacts de relais pour la surveillance des valeurs seuil. <br> <br> Les composants du compteur programmable de la série PTX800 avec affichage numérique 8 bits peuvent traiter les signaux TTL côté entrée ou optionnellement les impulsions provenant des capteurs NAMUR et NPN/PNP. Des fonctions de linéarisation complète et de suppression des interférences sont disponibles pour les signaux de mesure de processus. Côté sortie se trouve optionnellement un <br> signal analogique mA/V et 2 contacts inverseurs pour la surveillance des seuils.<br> <br> Chacun des compteurs fournit une tension de 24 V DC pour l’alimentation de capteurs externes à deux conducteurs.|10620|Weidmüller|1545131258508-faab214b-b602-44b7-92e8-d0fc047a0221|DONE
1000054|FOCS|capteur de courant à fibre optique / à pince / DC|La sonde courante FOCS de fibre optique mesure des courants de C.C facilement avec les sondes courantes optiques de fibre fortement précise qui sont spécifiquement faites pour examiner les courants élevés de C.C. Avec des caractéristiques techniques faciles et flexibles. A un effet magnéto-optique ou l'effet de faraday en de fibre optique fini simple autour du conducteur désiré, le FOCS peut mesurer les courants continus ou bidirectionnels de C.C de ka jusqu'à 500 avec 0.1% valeur mesurée. Il garantit l'installation, l'assemblée et le transport rapides et faciles avec de haute résistance aux perturbations électromagnétiques dues à la mesure optique. Il donne également le calcul de précision et d'efficacité d'usine qui adapte idéalement n'importe quel environnement.|10622|abb|1545131267458-ec6d2fd7-af6c-4f01-9ef6-dab595c3c465|DONE
1000055|ACT20X-HAI-SAO/2HAI-2SAO HART|isolateur de signal / de courant / à sécurité intrinsèque / ATEX|Le Cerf-protocole d'ACT20X-HAI-SAO/2HAI-2SAO transparent courant-fournissent des isolants sont capable de transmettre 4… 20 signaux de mA de la zone ex 0 dans la zone sûre.<br> Des sondes externes peuvent être fournies avec la puissance par le dispositif.<br> <br> <br> L'alarme intégrée entre en contact avec l'issue une alerte en cas d'un défaut de fonctionnement ; ceci facilite le dépannage et augmente la disponibilité de système.<br> <br> <br> Les sur rail courant-fournissent des isolants sont sur option disponibles dans une ou à deux voies versions.<br> Avec la largeur de 11 millimètres par canal, les dispositifs ont besoin de peu d'espace dans le coffret électrique.|10622|Weidmüller|1545131275199-0c2dbe63-99ff-4198-8cdf-e02c9ae9cd5d|DONE
1000056|30 - 35 mm|capteur magnétique antidéflagrant|Carlo Gavazzi offre une gamme complète de détecteurs magnétiques à utiliser en application de détection de proximité. Ils sont utilisés conjointement avec un aimant magnétique : lorsque le détecteur approche l'aimant, sa sortie change d'état. Ces détecteurs ont une distance de détection plus grande que d'autres capteurs de proximité. De plus, la sortie est un contact mécanique. Grande variété de boîtiers rectangulaires ou cylindriques. Des magnétiques et aimants codés sont disponibles pour une utilisation en application de sécurité. Les détecteurs magnétiques sont fréquemment utilisés dans le domaine des ascenseurs, ouverture de portes, détection de niveau et contrôle d'accès.|10622|CARLO GAVAZZI|1545131279910-c621b123-5c1e-423a-ac95-6d878d93a4be|DONE
1000057|CR3114|système de diagnostic|Échange de données sans fil fiable pour machines mobiles<br> Diagnostic en temps réel via système de programmation CODESYS<br> Affichage et sauvegarde des données via le portail Internet<br> Affichage et traitement de données de géo-localisation<br> Intégration dans le réseau machine via interface CAN/CANopen|10622|IFM|1545131284621-67fd37fa-73d8-4749-978b-24e613985f32|DONE
1000058|EC2100, EC2036|système de diagnostic|Terminal portatif de surveillance et entrée des télégrammes de données dans les systèmes CAN<br> Paramétrage de nœuds CAN<br> Édition en texte clair des télégrammes CAN<br> Analyse confortable de réseaux CAN grâce à l’écran tactile|10622|IFM|1545131288873-a06a1e2e-e57e-4806-a45e-d6de9200474c|DONE
