product_id|model|label|description|category_id|brand|image|status
1000059|JUMPFLEX® 857 series|transducteur de courant à transformateur / sur rail DIN / AC / DC|Les 857 séries de JUMPFLEX® sont la plus nouvelle ligne de WAGO des amplificateurs et des capteurs de bonne qualité et faciles à utiliser d'isolement. Ces dispositifs qui peuvent résister à une température ambiante de -25 à +70°C te permettent d'ajuster et amplifier des signaux dans une variété décente d'environnements. Cette série de situation actuelle comporte une variété de possibilités et de composants comprenant, de pleines possibilités de jumpering, une unité de commande démontable, une technologie variable de raccordement qui peut être branchée, fixé ou vider, un éventail d'options d'inscription, aussi bien qu'une variété de possibilités de raccordement. Grâce à ces possibilités et technologies, les dispositifs séries du JUMPFLEX® de WAGO de 857 permet à l'utilisateur d'augmenter la disponibilité de machine et de système près efficacement et efficacement augmentant la qualité du signal avec la facilité relative.|10622|wago|1545131294313-4dd7b910-048d-489e-8407-11e5e33e1f41|DONE
1000060|KT50 series|capteur tactile capacitif|Commutation sans contact et sans pression<br> LED pour signalisation visuelle<br> Résistant à l'huile, résistant aux impacts et à l'abrasion<br> Enjoliveurs disponibles en différentes couleurs<br> Montage mural ou encastré simple|10623|IFM|1545131299658-a4c8106d-5b27-47a4-aee2-1110218e7982|DONE
1000061|KT53 series|capteur tactile capacitif|Sans usure, ni entretien grâce à la commutation sans pression mécanique<br> Principe dynamique pour la suppression de tentatives de manipulation<br> Montage facile dans des boîtiers avec un trou de montage de Ø 22,5 mm<br> Principe de contrôle prédéfini, dynamique ou statique<br> Symboles sur la surface active sélectionnables séparément|10623|IFM|1545131304759-5ca18746-12cf-4d7a-9975-33eac4e703c8|DONE
1000062|IcountPD|détecteur de particules / pour fluide hydraulique / pour applications hydrauliques|Dtecteurs de particules Icount PD<br> <br> Dtecteur de particules pour l'analyse en ligne de la pollution des fluides hydrauliques. Mesure de teneur en eau en option. Affichage digital ou LED. Pression maximum : 420 bar. Une solution conomique pour prolonger la dure de vie du fluide et du systme.|10623|Parker|1545131309608-c69de629-c6bb-4ebb-b50f-1355130bb2ad|DONE
1000063|icount PDR|détecteur de particules / robuste / pour liquide|Détecteur de particules icount PDR - version robusteDétecteur de particules pour l'analyse en ligne de la pollution des fluides dans les environnements agressifs.|10623|Parker|1545131314868-0e5c06ee-e036-4357-8e00-d0149f539eb2|DONE
1000064|RayCleanTM|unité de purification d'eau|Garde RayClean d'océan de DESMI<br> Système de traitement à l'eau de ballast<br> <br> Efficace prouvé dans toutes les salinités de l'eau avec UV-T (UV-Transmission) aussi bas que 0.33 ce qui place le repère d'industrie.<br> <br> RayClean<br> - la plus basse consommation d'énergie dans la classe<br> Le système de traitement à l'eau de ballast de RayClean est le principal système dans l'industrie marine avec l'exécution incomparable de traitement et la plus basse consommation d'énergie dans la classe.<br> <br> RayClean est examiné pour rencontrer les dernières conditions et directives adoptées par l'organisation maritime internationale (IMO) et le garde côtier des USA.<br> L'essai d'homologation progresse selon les la prévisions et des homologations d'IMO et d'USCG sont prévues début 2014.<br> <br> RayClean peut être employé dans toutes les salinités et températures de l'eau, et ajuste automatiquement le traitement afin d'assurer la conformité d'IMO et d'USCG à tout moment à la puissance d'énergie exigée minimum.|20427|DESMI|1545131322302-3e09ee11-686a-4480-be04-0dfff968f2d4|DONE
1000065|CR0403, CR0401|automate programmable|Pour fonctions de commande simples dans les véhicules et engins mobiles<br> Avec de nombreuses entrées et sorties multifonctions configurables<br> Interfaces CAN puissantes pour de nombreuses applications de communication<br> Librement programmable suivant CEI 61131-3 avec CODESYS<br> Homologation de type E1 de l'office fédéral allemand sur la circulation des véhicules automobiles pour l'emploi dans des conditions sévères|30101|IFM|1545131328557-77d8443a-ed03-425c-be85-662f93eaa6fe|DONE
1000066|CR2530, CR2500|automate programmable|Pour des fonctions de commande complexes dans les véhicules et engins mobiles<br> Avec de nombreuses entrées et sorties multifonctions configurables<br> Interfaces CAN puissantes pour de nombreuses applications de communication<br> Librement programmable suivant CEI 61131-3 avec CODESYS<br> Homologation de type E1 de l'office fédéral allemand sur la circulation des véhicules automobiles pour l'emploi dans des conditions sévères|30101|IFM|1545131333041-acdfd1fb-fce5-4a0c-b1d1-59381ef27c48|DONE
1000067|CR0032, CR033, CR0505, CR0020|automate programmable|Pour des fonctions de commande complexes dans les véhicules et engins mobiles<br> Avec de nombreuses entrées et sorties multifonctions configurables<br> Interfaces CAN puissantes pour de nombreuses applications de communication<br> Librement programmable suivant CEI 61131-3 avec CODESYS<br> Homologation de type E1 de l'office fédéral allemand sur la circulation des véhicules automobiles pour l'emploi dans des conditions sévères|30101|IFM|1545131337867-a690c754-686a-43a5-b594-35b619bf163d|DONE
1000068|CD12/CD20 smart series|automate programmable compact / sur rail DIN / entrées analogiques / avec E/S intégrée|Afficheur LCD bleu très visible de 4 lignes de 18 caractères, avec rétro-éclairage pilotable<br> Compatible avec l'ensemble de la bibliothèque de fonctions métier de l'atelier logiciel<br> Gamme de température étendue (-20 °C →+70 °C) <br> Entrées analogiques 0-10 VDC, potentiomètre, CTN, LDR (0-20 mA/Pt100 avec convertisseurs) <br> Paramétrage sélectif : possibilité de choisir les paramètres réglables en face avant|30101|crouzet|1545131343266-2afe810e-a60e-4a29-8ec3-7e0eb504c69f|DONE
1000069|750-872|automate programmable sur rail DIN / avec E/S intégrée / pour bus de terrain / Modbus|Elle offre un grand nombre de protocoles d'application que l'utilisateur peut exploiter pour la commande des données de bornes (MODBUS TCP/<br> ‐RTU, CEI60870‐5‐101/‐104, 3964R, RK512, ETHERNET/IP) ou pour la gestion et le diagnostic du système (HTTP, BootP, DHCP, DNS, SNTP, FTP, SNMP et SMTP). Pour les applications basées sur le web, il y a un serveur web à disposition sur lequel on peut charger des pages HTML. Les programmes peuvent être appelés directement via XML et ASP. Des librairies de fonctions pour les mails, SOAP, ASP, configuration IP, sockets ETHERNET et gestion de fichiers complètent le produit.<br> <br> L'API basé sur un processeur 32 bits est multi-tâche et dispose d'une horloge temps réel sauvegardée. La constitution du programme d'automatisme est effectuée selon la norme CEI 61131‐3. Le programmeur accède à toutes les données du bus de terrain et d'E/S. Un programme CoDeSys permet au programmeur de l'API l'accès aux protocoles de téléconduite CEI 60870‐5‐101 et 104, CEI 61400-25 par l'intermédiaire de blocs fonctionnels.|30101|wago|1545131349990-52edda4f-b6dd-44c0-9d97-d4e1c24fce3e|DONE
1000070|Parker Hannifin France SAS|automate programmable avec E/S intégrée / sorties numériques / pour bus de terrain / modulaire|Le système d'E/S modulaire PIO de Parker permet de connecter à une large gamme de bus de terrain industriels une grande variété de capteurs au niveau de la machine. La connexion au niveau machine peut être réalisée rapidement et de façon fiable avec les PIO.|30101|Parker|1545131354118-6199f206-5779-4d03-af56-f53980520504|DONE
1000106|CCES|compteur volumétrique / numérique / électronique / pour montage sur panneau|<br> Afficheur LCD à 8 caractères<br> Alimentation électrique autonome<br> Pour montage en panneau<br> Raccordement avec barrette de fixation<br> Touche de rappel en position initiale.|30113|festo|1545131169770-03868aea-844b-4dca-9aa6-456a826decf2|DONE
1000107|7E series|compteur d'énergie / numérique / analogique / électronique|kWh Compteur d'énergie<br> <br> 1 ou 3 phases<br> Mono ou double tarif<br> Sortie émettrice d'impulsions (sortie transistor collecteur ouvert) pour le contrôle à distance de l'énergie selon DIN 43864; utililisé pour la liaison du compteur à un système de gestion centralisé<br> Montage sur rail 35 mm (EN 60715)|30113|finder|1545131174173-6954dae1-cafb-4f50-afc1-8641b9009ce4|DONE
1000108|DW2503|convertisseur fréquence / courant|Sortie de courant ou de tension proportionnelle à la fréquence<br> Fréquence d'entrée élevée de 60 000 impulsions / minute max.<br> De nombreuses fonctions de surveillance paramétrables<br> Affichage OLED luminescent bien lisible<br> Large plage de température de fonctionnement|30114|IFM|1545131179173-f194ef9a-7dc0-47e9-a432-462c2a4b15a1|DONE
1000109|88950108|convertisseur tension / courant|Conversion courant-tension des signaux d'entrées Millenium 3<br> Conversion PWM-tension des signaux de sortie Millenium 3|30114|crouzet|1545131183713-eb490b92-9b02-41e6-ae09-ef9d1a533a50|DONE
1000110|Weidmüller|convertisseur|Les isolateurs convertisseurs universels de signaux / commutateurs à seuil offrent la possibilité d'enregistrer à volonté des<br> signaux normalisés de courant / tension, des valeurs de mesure de températures des capteurs à 2/3/4 fils RTD, de thermo<br> couples usuels et de résistances linéaires et non linéaires. Ils sont en outre optionnellement capables d'exploiter les fréquences<br> de transmetteurs Namur ou à 2/3 fils NPN/PNP.<br> <br> Les courbes de signaux de types de capteurs au choix sont conservées et linéarisées au niveau interne. Des signaux de tension et de courant<br> DC normalisés sont disponibles à la sortie. Les valeurs seuils sont surveillées par des sorties de<br> commutation additionnelles (relais / transistor). <br> Les appareils sont disponibles avec une alimentation 24 V DC externe ou une alimentation AC/DC à large plage de tension, ou<br> peuvent optionnellement être alimentés par la boucle de courant de sortie de 4 à 20 mA.<br> <br> Une haute précision, une plage de température étendue et une isolation complète double ou triple comptent parmi les autres caractéristiques idéales<br> pour une utilisation universelle dans les applications industrielles et de process.<br> Le paramétrage s'effectue par des outils logiciels spécifiques au fabricant (T-SET) ou standardisés (FDT/DTM).<br> Les agréments internationaux tels que cULus, ATEX Zone2, FM Div 2, GL, GL et DNV permettent l'utilisation de<br> ces isolateurs convertisseurs de signaux dans le monde entier et dans un grand nombre d'applications.|30114|Weidmüller|1545131187994-84e7fd2a-e75f-46e1-bab0-c8d9044ca47f|DONE
1000111|AC412S, AC422S, AC402S|passerelle de communication / de sécurité / AS-Interface / pour automate programmable|Les passerelles AS-i avec fonctionnalité API commandent de manière fiable l'échange de données avec le niveau capteur/actionneur et communiquent rapidement avec le niveau de commande supérieur. Elles peuvent être utilisées comme commande décentralisée autonome ou comme passerelle vers les bus de terrain les plus courants. La gamme comprend par exemple des interfaces avec Ethernet/IP et PROFINET.<br> Les appareils consistent en deux commandes dans un même boîtier. Le premier API solutionne les tâches liées à la sécurité et le deuxième API fonctionne comme un API standard. Les deux commandes communiquent mutuellement, et il est donc possible de mettre en œuvre avec un seul maître une commande d'installation complète incluant les fonctions de sécurité et les visualisations.<br> L'API sécurisé est certifié pour une utilisation dans des applications relatives à la sécurité jusqu'à SIL3, PL e. L'appareil dispose d'entrées et sorties locales sécurisées. Des fonctions confortables de diagnostic, comme par exemple un indicateur d'état pour les E/S sécurisées et une mémorisation des défauts avec horodatage pour les messages, facilitent la recherche des erreurs et réduisent les temps d'arrêt.<br> Grâce à l'afficheur couleur, l'état de tous les esclaves AS-i sur site est consultable en un coup d’œil. Une visualisation des données des capteurs/actionneurs est aussi possible via le serveur Web intégré.<br> Les API puissants peuvent être facilement programmés avec le logiciel CODESYS.|30115|IFM|1545131192539-055d1071-6fa0-47b4-9dd9-b5d80c62025a|DONE
1000112|AC14, AC13 series|passerelle AS-Interface / de communication / EtherNet/IP / PROFIBUS|Écran couleur pour le diagnostic avancé et mise en service facile<br> Détection fiable d’adresses AS-i en double<br> contrôleur d'isolement intégré<br> Menu quick-setup avec utilisation intuitive<br> Interface pour de nombreux bus de terrain standards|30115|IFM|1545131201296-6a8c4710-872f-43d9-8f4e-61ff4340923b|DONE
1000113|AC14, AC13, AC 10 series|passerelle pour automate programmable / de communication / AS-Interface|Contrôleur avec profil maître AS-i M4<br> Passerelles pour différents bus de terrain<br> Prise en charge de tous les esclaves avec la spécification AS-i 10 à 30<br> Possibilités de diagnostic avancées<br> Configuration confortable avec l’environnement de programmation CODESYS|30115|IFM|1545131206080-e20de21e-06a7-4e24-8e27-a973c8d63bef|DONE
1000114|SAI-AU PRO series|passerelle de communication / EtherNet/IP / TCP / USB|Il existe de nombreuses passerelles d'E/S.. Sont disponibles PROFIBUS-DP, DeviceNet, USB et les dialectes Ethernet : EtherNet/IP, Modbus TCP et PROFINET IO. Les passerelles disposent de 16 entrées digitales et le module USB offre en plus 8 sorties. Le module USB est connecté à un port USB sur un PC et, après l'installation du pilote, fonctionne sur n'importe quel port USB. Il est possible de l'implémenter avec le protocole Modbus.|30115|Weidmüller|1545131210734-ee4b7210-88e2-4785-8c7e-7ed7b61a9515|DONE
1000115|AC5, AC0, E7015S series|module E/S de sécurité|Modules AS-i sûrs pour l’utilisation sur terrain et dans l’armoire électrique<br> Intégration des composants de sécurité dans AS-i<br> Raccordement de contacts mécaniques de sécurité et capteurs de sécurité 3 fils<br> Trois orientations au choix du câble plat pour les modules avec technique de montage rapide<br> Certification selon EN 62061 / SIL3 et EN ISO 13849-1 / PL e|30116|IFM|1545131216768-8e5402cd-09af-4794-a479-bdb6e4f1aa4e|DONE
1000116|AC5 series|module d'E/S AS-i / numérique / analogique / durci|Grande simplicité et flexibilité de montage et indice de protection élevé<br> Entrées et sorties TOR<br> Détection et traitement rapides des entrées analogiques<br> Montage sans outil<br> Câble plat orientable dans trois directions différentes|30116|IFM|1545131221586-519b7aa5-d2d1-4e43-b172-8a543b99d1a1|DONE
1000117|AC25, AC00 series|module E/S numérique / analogique / à 4 sorties analogiques / à 4 entrées analogiques|2x2 entrées TOR pour les états de commutation et 2 sorties alimentées via AS-i<br> Quatre entrées TOR pour l'état de commutation et quarte entrées pour le contrôle de fonction<br> Quatre entrées analogiques, quatre sorties analogiques ou quatre voies Pt100 au choix<br> Alimentation de capteurs et d'actionneurs aussi possible avec une tension externe<br> Indice de protection élevé pour le montage direct sur le terrain|30116|IFM|1545131226680-bb38b74b-2b3c-46f2-b617-54daf87aa9f0|DONE
1000118|XA03 / XA04W|module E/S analogique / de température / à montage sur rail DIN|3 entrées température Pt100 dans un même boîtier<br> Exemple d’applications » métier » : régulation et mesure de température<br> Extension compatible avec les contrôleurs logiques extensibles de la gamme Millenium 3 Smart|30116|crouzet|1545131231486-80b3179c-3e85-4a6f-87ac-bfdd67f0dedd|DONE
1000119|750 series|module d'E/S numérique / analogique / 4 canaux / à montage sur rail DIN|Le système WAGO-I/O-SYSTEM peut être installé en zone 2/22. Il peut aussi remonter et piloter des capteurs actionneurs se trouvant en zone 0/20 ou 1/21.<br> Bornes d'alimentation DC-24V (1,0 A)<br> Bornes d'entrées digitales à 1, 2, 8 canaux NAMUR<br> Bornes d'entrées digitales à 4 canaux PROFIsafe V2 iPar<br> Borne de sortie digitale à 2 canaux (jusqu'à 40 mA, Relais)<br> Bornes d'entrées analogiques à 2 canaux (4-20 mA, 4-20 mA HART, RTD, TC)<br> Borne de sorties analogiques à 2 canaux (0-20 mA, 4-20 mA)<br> Module compteur|30116|wago|1545131236878-e97ca817-7edb-4496-aba6-12ebc1bc9ec7|DONE
1000120|Universal Pro series|module E/S universel / numérique / analogique|Le passage de l'IP20 vers l'IP67 c'est à dire la suppression des armoires dans les machines se fait particulièrement sentir avec les E/S esclaves IP67. Avec ces solutions plug &amp; play le câblage de fils individuels disparaît complètement. On gagne ainsi énormément de temps et on évite les erreurs de câblage. Les modules de bus IP67 représentent aujourd'hui la solution la plus moderne et la plus économique pour raccorder des capteurs et des actionneurs.|30116|Weidmüller|1545131242535-eb02e527-1fb0-4a4e-9827-bcd6a727db78|DONE
