product_id|model|label|description|category_id|brand|image|status
1000451|GDL Origa series|guidage linéaire à rouleaux croisés / en aluminium / silencieux / inoxydable|Guidages linaires rouleaux croiss GDL Origa. Tailles 12, 15, 20, 25, 35 et 45, longueurs des rails disponibles de 300 4000 mm (autres longueurs sur demande).<br> <br> Les guidages pour rouleaux croiss en aluminium allient parfaitement performances et lgret. Ils sont extrmement silencieux et prcis. Les guidages rouleaux croiss en aluminium (rail et chariot mobile) servent de support la construction d installations souples et solides pour le montage et l automatisation. Ils sont conus pour la manutention conomique de charges moyennes. L utilisation de composants en aluminium lgers permet de rduire les masses dplaces, d augmenter les vitesses de dplacement et d conomiser de l nergie. Pistes de roulement polies et calibrs. Fonctionnement trs rgulier grce aux galets roulement aiguilles. La vitesse de dplacement de ces guidages, qui peut atteindre 10 m/s, offre des possibilits d applications dans de nombreux domaines. Galets croiss pour des charges dans toutes les directions. Systme de guidage quasiment exempt de graisse. Rails doubles ou simples. Versions standard ou inoxydable. Pour des courses plus longues, les rails de guidage peuvent s abouter.|50216|Parker|1545131334495-a4a42409-d76f-4f33-95fa-3e33d3797628|DONE
1000452|MTR-DCI|unité d'entraînement|<br> Taille 32, 42, 52, 62<br> Couple 0,15... 11,66 Nm<br> Tension 24, 48 V CC<br> Courant nominal 0,73 ... 6,19 A<br> Câble moteur adapté.|50312|festo|1545131339074-970ef504-2918-4b68-b27a-0281d8b7d13c|DONE
1000453|Crouzet|réducteur pour moteur DC / planétaire / à vis sans fin / à train d'engrenages|Nos moteurs de brosse de C.C sont disponibles en tant que commandes directes ou embrayés|50338|crouzet|1545131343657-cf66432a-5b42-4739-bf22-39367b711461|DONE
1000454|PR/RS, PE series|réducteur planétaire / coaxial / silencieux / robuste|Les réducteurs sont disponibles en version axiale ou orthogonale dans 8 tailles et 12 rapports de réduction. Avec des vitesses d'entrée jusqu'à 6000 min-1 et un fonctionnement silencieux, robuste et fiable, vous pouvez être sûr qu'il y a un réducteur correspondant à vos applications performantes.|50338|Parker|1545131348899-f1e92725-a802-4f43-9405-c33f6bfbe15f|DONE
1000455|Crouzet|réducteur pour moteur DC / planétaire / à vis sans fin / à train d'engrenages|Nos moteurs de brosse de C.C sont disponibles en tant que commandes directes ou embrayés|50339|crouzet|1545131353223-9e304925-78b9-4394-991a-fcdab29472df|DONE
1000701|MS12-LOE|lubrificateur pour air comprimé|<br> Connexion G1, G1 1/4, G1 1/2, G2<br> Débit 20000 … 22000 l/min.|70206|festo|1545131169308-60e24e57-084b-4333-8693-d0c9f14706d8|DONE
1000702|DESLUBE|pompe à huile / électrique / immergée / centrifuge|DesLube de Desmi fait partie des solutions marines et en mer de la compagnie de produit. Généralement utilisé pour des opérations fournir-connexes principales d'huile de lubrification de moteur, cette basse-NPSH, à faible bruit/par vibration submergée pompe d'huile de lubrification peut également être utilisée pour de grandes applications de moteur de deux-course. Cette pompe adaptable est manufacturée basée sur les pompes profondes-bien et les unités centrifuges intégrées de la compagnie. Sa structure pleine garantit les opérations de haute qualité. Ceci assure également des besoins d'entretien minimaux. <br> <br> Le DesLube peut être intégré dans le marécage bride-soutenu par dôme. Ces possibilités d'intégration n'ont pas besoin des mécanismes supplémentaires de suspension. Quand les chutes de pression d'huile lubrifiante, cet appareil augmente le débit global, afin de réduire au minimum les risques des dommages complets qui peuvent par la suite casser le moteur principal.|70210|DESMI|1545131173362-18deae04-f381-4fe5-9a10-c1d1d76d58b4|DONE
1000703|DMS series|visseuse électrique sans fil / modèle pistolet / à contrôle de couple / à chocs|Les tournevis dynamométrique Weidmüller ont une forme ergonomique et se prêtent bien de ce fait à une utilisation d'une seule main. Ils permettent de travailler sans fatigue dans toutes les directions de montage. Vous disposez en plus d'une limitation automatique du couple et d'une grande précision de reproductibilité.|70301|Weidmüller|1545131178692-f663b4e6-9836-4799-84ff-98d78ed016a0|DONE
1000704|Weidmüller|pince coupante / pour l'électronique / isolante|Pour travailler sous tension il faut respecter des consignes de sécurité particulières et utiliser des outils conçus et testés à cet effet.<br> Weidmüller propose aux utilisateurs toute une gamme de pinces qui répondent à l'ensemble des normes nationales et internationales.<br> Toutes les pinces sont fabriquées et testées selon la DIN EN 60900.<br> Sur le plan ergonomique, les pinces ont été adaptées à la forme de la main. La main est ainsi mieux positionnée et les doigts ne sont pas serrés ce qui est moins fatigant.|70316|Weidmüller|1545131184796-7c0fd311-8e33-4962-a50d-1a5817157f8c|DONE
1000705|Weidmüller|pince à dénuder universelle / pour câble|Weidmüller est un spécialiste du dénudage et du dégainage des câbles. La gamme des produits couvre aussi bien les pinces à dénuder pour petites sections que les outils à dégainer pour les gros diamètres. <br> Avec sa large gamme d'outils à dénuder et à dégainer, Weidmüller répond à tous les critères d'une préparation professionnelle des câbles.|70317|Weidmüller|1545131189474-443877cb-1e9b-4146-a43d-a27e702a0431|DONE
1000706|Weidmüller|coupe-câble manuel / à cliquet|Outils à couper pour conducteurs jusqu'à 8 mm, 12 mm, 14 mm et 22 mm de diamètre extérieur. La géométrie de coupe spéciale assure une coupe nette et sans écrasement des conducteurs en cuivre et aluminium avec un effort physique minimum. En outre, les outils à couper sont munis d'une protection isolante testée VDE et GS jusqu'à 1 000 V, conformément aux normes EN/CEI 60900.|70318|Weidmüller|1545131196250-e7315145-993d-4e05-8451-4b1aaf80acd0|DONE
1000707|Weidmüller|outil de sertissage hydraulique / manuel / pour borne de câbles|Pinces à sertir avec inserts interchangeables pour cosses, connecteurs et embouts.<br> <br> • Large choix d'inserts de sertissage normalisés <br> • Large choix d'outils mécaniques, hydrauliques et électro-hydraulique <br> • large plage d'action jusqu'à 300 mm² <br> • Possibilité de déverrouillage en cas de fausse manœuvre|70334|Weidmüller|1545131201656-6596116a-6d7f-4fd0-a332-9b93c81a6638|DONE
1000708|EVcc-PR series|lampe torche à LED / d'inspection / antidéflagrante|EVcc-PR-LED Series : projecteur LED compact - aluminium exempt de cuivre.|70340|MARECHAL ELECTRIC|1545131206592-eda84760-91bc-4ee4-abfb-f875f88974c9|DONE
1000709|EVcc-PR series|lampe torche à LED / d'inspection / antidéflagrante|EVcc-PR-LED Series : projecteur LED compact - aluminium exempt de cuivre.|70343|MARECHAL ELECTRIC|1545131211087-b21ca149-d042-4be6-832a-78b96fb8087b|DONE
1000710|EVcc-PR series|lampe torche à LED / d'inspection / antidéflagrante|EVcc-PR-LED Series : projecteur LED compact - aluminium exempt de cuivre.|70344|MARECHAL ELECTRIC|1545131217213-c786e682-1b51-4826-b838-cef6e7822fb9|DONE
1000711|Weidmüller|collier de câblage en polyamide|Les colliers de câble permettent d'organiser correctement le câblage de l'installation. Les colliers de câble se caractérisent par leur résistance et leur longue durée de vie. Les colliers de câble en acier offrent en outre une fixation permanente dans des conditions extrêmes, telles que des températures élevées ou des influences chimiques importantes. <br> Colliers de serrage CB pour la fixation de câbles et de repères. Ils sont particulièrement adaptés à la fixation des repères de câble CLI M, SFX, WKM et WKS. Le matériau utilisé est du polyamide PA 6.6 résistant à la rupture, avec une classe dinflammabilité V2 à UL-94|70420|Weidmüller|1545131221684-7fc61f18-ec2b-4772-9577-8c2aa5f304c7|DONE
1000712|2300/2400 series|élément de fixation métallisé / à coller|Les produits des séries ThreeBond 2300 et 2400 utilisent une technologie développée pour satisfaire aux exigences extrêmement complexes. Le processus est un processus de placage spécial au cours duquel les résines sont appliquées sur les filetages des vis ou des boulons, remplaçant ainsi la nécessité d’utiliser des anaérobiques liquides, rubans d’étanchéité ou joints d’étanchéité liquides.<br> <br> Au cours du procédé MEC, un agent d’étanchéité et de colmatage microencapsulé extrêmement réactif est appliqué sur les filetages des vis, boulons ou tuyaux. L’agent ne réagit pas tant que la pièce n’est pas serrée. Les microcapsules se rompent ensuite et l’agent d’étanchéité et de colmatage se polymérise instantanément pour éviter d’éventuels desserrages ou fuites.|70427|THREEBOND|1545131226748-dd386714-fe93-4f20-b6f9-4e0b67c6af56|DONE
1000713|Parker Hannifin France SAS|bouchon rond / mâle / en nylon|Bouchons reniflards IP65Homologation IP65. Résistance au lavage au jet d'eau. Baffle anti-débordement. Matériau anticorrosion. Elément filtrant 10 microns. Option pressurisé. Montage 1 seul perçage, collerette 6 trous et à visser.|70448|Parker|1545131232022-7ce62db0-166b-49ac-87fe-75de37a90f3e|DONE
1000714|SA Origa series|amortisseur de choc / mécanique / pour machine|Amortisseurs de chocs SA Origa. Amortisseurs rglables et non rglables. Courses amortissement jusqu  76 mm, nergie absorbe jusqu  146000 Nm/h.<br> <br> Une solution pour chaque application. Leur grande capacit d amortissement et leur construction renforce leur assurent une dure de vie importante dans les conditions les plus svres d utilisation. Ils permettent d'amener une masse en mouvement l'arrt, rapidement et en toute scurit, sans rebondissement ni recul. Les amortisseurs de chocs permettent une dclration linaire et contrle sur une course prdfinie. Ils fonctionnent par la conversion de l'nergie cintique en nergie thermique, par pressurisation d un fluide hydraulique travers des orifices calibrs. L'utilisation d'un amortisseur de chocs offre les avantages suivants : rduit la maintenance, le bruit et les chocs pour augmenter la dure de vie de la machine, des vitesses de fonctionnement plus importantes pour amliorer le taux de production, de rduire les cots de construction et d amliorer la qualit de production tout en prservant la scurit. Une vaste gamme de taille est disponible pour des masses de quelques grammes jusqu  plusieurs tonnes.|70453|Parker|1545131239997-75080d2b-f9ec-46a2-82f2-e9055e041373|DONE
1000715|DYSR|absorbeur de choc / mécanique / réglable|<br> Course 8 … 60 mm<br> Absorption d'énergie max. par course 4 … 384 J<br> Amortissement réglable|70453|festo|1545131246278-18655c95-a8b0-4148-ade7-3fda8cce7463|DONE
1000716|YSR-C|absorbeur de choc / mécanique|<br> Course 4 … 60 mm<br> Absorption d'énergie max. par course 0,6 … 380 J<br> Amotissement auto-progressif.|70453|festo|1545131252119-637fa1f2-ec06-4570-a4ad-b4fe21422ed1|DONE
1000717|YSRW|absorbeur de choc / mécanique|<br> Course 8 … 34 mm<br> Absorption d'énergie max. par course 1,3 … 70 J<br> Amortissement auto-ajustable, courbe d'amortissement douce.|70453|festo|1545131256955-4982d362-50e0-480d-a98e-abe130f9917e|DONE
1000718|SA Origa series|amortisseur de choc / mécanique / pour machine|Amortisseurs de chocs SA Origa. Amortisseurs rglables et non rglables. Courses amortissement jusqu  76 mm, nergie absorbe jusqu  146000 Nm/h.<br> <br> Une solution pour chaque application. Leur grande capacit d amortissement et leur construction renforce leur assurent une dure de vie importante dans les conditions les plus svres d utilisation. Ils permettent d'amener une masse en mouvement l'arrt, rapidement et en toute scurit, sans rebondissement ni recul. Les amortisseurs de chocs permettent une dclration linaire et contrle sur une course prdfinie. Ils fonctionnent par la conversion de l'nergie cintique en nergie thermique, par pressurisation d un fluide hydraulique travers des orifices calibrs. L'utilisation d'un amortisseur de chocs offre les avantages suivants : rduit la maintenance, le bruit et les chocs pour augmenter la dure de vie de la machine, des vitesses de fonctionnement plus importantes pour amliorer le taux de production, de rduire les cots de construction et d amliorer la qualit de production tout en prservant la scurit. Une vaste gamme de taille est disponible pour des masses de quelques grammes jusqu  plusieurs tonnes.|70454|Parker|1545131262937-0affa678-93e5-456c-8037-3ed7a3beac31|DONE
1000719|DYSR|absorbeur de choc / mécanique / réglable|<br> Course 8 … 60 mm<br> Absorption d'énergie max. par course 4 … 384 J<br> Amortissement réglable|70454|festo|1545131267458-d31b4847-5605-476d-b424-46cdb19f0aea|DONE
1000720|YSR-C|absorbeur de choc / mécanique|<br> Course 4 … 60 mm<br> Absorption d'énergie max. par course 0,6 … 380 J<br> Amotissement auto-progressif.|70454|festo|1545131273689-9d8b56bc-1576-4560-9a23-33ae6411e706|DONE
